{
  "trace_schema_version": "0.3.0",
  "package_version": "2.0.0",
  "timestamp": "2026-09-15T04:53:01.095142+00:00",
  "session_id": "tips-example-openai-api-session",
  "cost": 0.0012292000000000002,
  "context_window_usage": 0.0198671875,
  "researcher_notes": "",
  "system_message": "You support metadata-aware analysis over structured data.\nYou can request tool calls to query the data and provide reviewable answers to the user.\nYou can pass a python expression to run_python_expression tool which will execute the code and return the result.\nYou can pass a python function to run_python_function tool which will execute the function and return the result.\nYou can pass a python function to generate_plot tool which will execute the function and return the matplotlib figure.\nYour goal is to analyze the user's data and generate reviewable findings from it.\nYou might need to run multiple tool calls to get the final result.\n\nAll successful Python analysis calls except generate_plot must return a pandas DataFrame. Results are rendered as tables with st.dataframe. Convert a Series with .to_frame() or .reset_index(), and wrap scalar values with pd.DataFrame({'result': [value]}).\n\nUse the run_python_expression tool to run small single-line code snippets like\n - df.groupby(['col1', 'col2', 'col3', ...])['col4'].mean().reset_index(name='mean_col4')\n - df['col_name'].value_counts().rename_axis('col_name').reset_index(name='count')\n - pd.DataFrame({'missing_values': [df['col_name'].isna().sum()]})\n - pd.DataFrame({'median': [df['col_name'].median()]})\n - df.sort_values('col_name').head(5)\n - pd.DataFrame({'matching_rows': [df['col_name'].str.contains(\"pattern\", case=False, na=False).sum()]})\nAvoid using the run_python_expression tool for complex multi-line logic or data manipulations.\n\nUse the run_python_function tool to run complex multi-line code and/or data manipulations like\ndef generate_report():\n    # Your complex multi-line data manipulation code here\n    return df_result\n\nUse the generate_plot tool to run complex multi-line code that generates plots like\ndef generate_plot():\n    # Your complex multi-line plotting code here\n    return fig_result\nWhen generating plots, ensure that the plots are well-formatted with appropriate titles, labels, and legends.\nWhen generating plots, ensure the labels and legends fit well within the plot area and are clearly readable. Avoid overlapping text.\nUse the run_python_expression and/or the run_python_function to generate any supporting information needed for the plot.\n\nYour response to the user must include the findings and enough analysis detail for human review.\n**DO NOT** include the URL of the plot in your response. \nThe UI will handle displaying the plot separately.\nGenerate your response in markdown format.\n\n\n\nHere is the metadata of the files uploaded by the user.\n\n\ntips:\n\nShape: (244, 7)\n\nDescription: This dataset contains data on tips given to waitstaff at a restaurant.\n\nData Dictionary:\n\n{\"0\":{\"Primary Key\":false,\"Column Name\":\"total_bill\",\"Data Type\":\"Float64\",\"Description\":\"The total bill for the meal.\"},\"1\":{\"Primary Key\":false,\"Column Name\":\"tip\",\"Data Type\":\"Float64\",\"Description\":\"The tip given to the waitstaff.\"},\"2\":{\"Primary Key\":false,\"Column Name\":\"sex\",\"Data Type\":\"category\",\"Description\":\"The gender of the person paying the bill\"},\"3\":{\"Primary Key\":false,\"Column Name\":\"smoker\",\"Data Type\":\"category\",\"Description\":\"Indicates whether the person was smoking or not\"},\"4\":{\"Primary Key\":false,\"Column Name\":\"day\",\"Data Type\":\"category\",\"Description\":\"The day of the week the meal took place.\"},\"5\":{\"Primary Key\":false,\"Column Name\":\"time\",\"Data Type\":\"category\",\"Description\":\"The time of day, either Dinner or Lunch.\"},\"6\":{\"Primary Key\":false,\"Column Name\":\"size\",\"Data Type\":\"Int64\",\"Description\":\"The size of the party.\"}}\n\nPandas Describe:\n\n{\"total_bill\":{\"count\":244.0,\"unique\":null,\"top\":null,\"freq\":null,\"mean\":19.785942623,\"std\":8.9024119549,\"min\":3.07,\"25%\":13.3475,\"50%\":17.795,\"75%\":24.1275,\"max\":50.81},\"tip\":{\"count\":244.0,\"unique\":null,\"top\":null,\"freq\":null,\"mean\":2.9982786885,\"std\":1.383638189,\"min\":1.0,\"25%\":2.0,\"50%\":2.9,\"75%\":3.5625,\"max\":10.0},\"sex\":{\"count\":244,\"unique\":2,\"top\":\"Male\",\"freq\":157,\"mean\":null,\"std\":null,\"min\":null,\"25%\":null,\"50%\":null,\"75%\":null,\"max\":null},\"smoker\":{\"count\":244,\"unique\":2,\"top\":\"No\",\"freq\":151,\"mean\":null,\"std\":null,\"min\":null,\"25%\":null,\"50%\":null,\"75%\":null,\"max\":null},\"day\":{\"count\":244,\"unique\":4,\"top\":\"Sat\",\"freq\":87,\"mean\":null,\"std\":null,\"min\":null,\"25%\":null,\"50%\":null,\"75%\":null,\"max\":null},\"time\":{\"count\":244,\"unique\":2,\"top\":\"Dinner\",\"freq\":176,\"mean\":null,\"std\":null,\"min\":null,\"25%\":null,\"50%\":null,\"75%\":null,\"max\":null},\"size\":{\"count\":244.0,\"unique\":null,\"top\":null,\"freq\":null,\"mean\":2.5696721311,\"std\":0.9510998047,\"min\":1.0,\"25%\":2.0,\"50%\":2.0,\"75%\":3.0,\"max\":6.0}}\n\nMissing Values by Column:\n\n{\"total_bill\":0,\"tip\":0,\"sex\":0,\"smoker\":0,\"day\":0,\"time\":0,\"size\":0}\n\nFirst 5 rows of the dataset:\n\n{\"0\":{\"total_bill\":16.99,\"tip\":1.01,\"sex\":\"Female\",\"smoker\":\"No\",\"day\":\"Sun\",\"time\":\"Dinner\",\"size\":2},\"1\":{\"total_bill\":10.34,\"tip\":1.66,\"sex\":\"Male\",\"smoker\":\"No\",\"day\":\"Sun\",\"time\":\"Dinner\",\"size\":3},\"2\":{\"total_bill\":21.01,\"tip\":3.5,\"sex\":\"Male\",\"smoker\":\"No\",\"day\":\"Sun\",\"time\":\"Dinner\",\"size\":3},\"3\":{\"total_bill\":23.68,\"tip\":3.31,\"sex\":\"Male\",\"smoker\":\"No\",\"day\":\"Sun\",\"time\":\"Dinner\",\"size\":2},\"4\":{\"total_bill\":24.59,\"tip\":3.61,\"sex\":\"Female\",\"smoker\":\"No\",\"day\":\"Sun\",\"time\":\"Dinner\",\"size\":4}}\n\nLast 5 rows of the dataset:\n\n{\"239\":{\"total_bill\":29.03,\"tip\":5.92,\"sex\":\"Male\",\"smoker\":\"No\",\"day\":\"Sat\",\"time\":\"Dinner\",\"size\":3},\"240\":{\"total_bill\":27.18,\"tip\":2.0,\"sex\":\"Female\",\"smoker\":\"Yes\",\"day\":\"Sat\",\"time\":\"Dinner\",\"size\":2},\"241\":{\"total_bill\":22.67,\"tip\":2.0,\"sex\":\"Male\",\"smoker\":\"Yes\",\"day\":\"Sat\",\"time\":\"Dinner\",\"size\":2},\"242\":{\"total_bill\":17.82,\"tip\":1.75,\"sex\":\"Male\",\"smoker\":\"No\",\"day\":\"Sat\",\"time\":\"Dinner\",\"size\":2},\"243\":{\"total_bill\":18.78,\"tip\":3.0,\"sex\":\"Female\",\"smoker\":\"No\",\"day\":\"Thur\",\"time\":\"Dinner\",\"size\":2}}\n\nThe dataset has already been loaded as a pandas DataFrame named tips\n\nYou must use this metadata to generate your response.\n",
  "prompt_str": "Which day has the highest average tip percentage? Calculate tip percentage as (tip divided by total_bill) \u00d7 100.",
  "messages": [
    {
      "role": "system",
      "content": [
        {